{
  "schemaVersion": "adlc-run/v1",
  "runId": "2026-08-19-a1b2",
  "createdAt": "2026-08-19T09:00:00Z",
  "referencesRun": null,
  "repo": "octo-org/octo-app",
  "baseSha": "3f1a9c7e2b4d6081a5c3e7f902b4d6081a5c3e7f",
  "headSha": "c7e2b4d6081a5c3e7f902b4d6081a5c3e7f90213",
  "prNumber": 42,
  "status": "reported",
  "profile": "full",
  "capabilities": {
    "agents": "fake",
    "flags": "flagd-file",
    "evals": "deterministic",
    "evidence": "playwright",
    "export": "oes"
  },
  "stages": [
    {
      "stage": "intake",
      "attempt": 1,
      "status": "ok",
      "startedAt": "2026-08-19T09:00:00Z",
      "endedAt": "2026-08-19T09:00:04Z",
      "outputs": ["brief.md"],
      "message": "brief accepted from issue #118",
      "data": { "issue": 118 }
    },
    {
      "stage": "experiment",
      "attempt": 1,
      "status": "ok",
      "startedAt": "2026-08-19T09:10:00Z",
      "endedAt": "2026-08-19T09:10:01Z",
      "outputs": ["experiment/plan.json"],
      "digest": "sha256:1d1f0b6f3f7c9a2e4b8d0c5a7e9f1b3d5f7a9c1e3b5d7f9a1c3e5b7d9f1a3c5e",
      "message": "pre-registered 2 variants and 4 metrics for experiment 'exp-dark-mode-a1b2'",
      "data": {
        "phase": "plan",
        "experiment": {
          "id": "exp-dark-mode-a1b2",
          "title": "Dark mode: token-driven theme vs. duplicated stylesheet",
          "status": "planned",
          "hypothesis": "Deriving the dark theme from design tokens lowers Largest Contentful Paint and removes the remaining contrast violations, without regressing bundle size beyond budget.",
          "summary": "Two build candidates at two commits, compared on a fixed evidence suite.",
          "tags": ["ui", "accessibility"]
        },
        "design": {
          "type": "quasi_experiment",
          "analysisUnit": "build_run",
          "assignmentMethod": "deterministic_build_variant",
          "exposureDefinition": "each variant is a build artifact at a commit; exposure is a CI evaluation, not live user traffic"
        },
        "variants": [
          {
            "id": "control",
            "key": "control",
            "role": "control",
            "codeReferences": [
              {
                "type": "git_commit",
                "value": "3f1a9c7e2b4d6081a5c3e7f902b4d6081a5c3e7f",
                "repo": "octo-org/octo-app"
              }
            ]
          },
          {
            "id": "candidate-a",
            "key": "candidate-a",
            "role": "treatment",
            "featureFlagKeys": ["adlc.exp.a1b2"],
            "codeReferences": [
              {
                "type": "git_commit",
                "value": "c7e2b4d6081a5c3e7f902b4d6081a5c3e7f90213",
                "repo": "octo-org/octo-app"
              }
            ]
          }
        ],
        "metrics": [
          {
            "id": "lcp_ms",
            "name": "Largest Contentful Paint",
            "role": "primary",
            "direction": "decrease_is_good",
            "type": "duration",
            "unit": "ms",
            "budget": 2500,
            "source": "benchmarks.yaml"
          },
          {
            "id": "a11y_violations",
            "name": "Axe critical violations",
            "role": "guardrail",
            "direction": "decrease_is_good",
            "type": "count",
            "budget": 0,
            "source": "benchmarks.yaml"
          },
          {
            "id": "rubric_overall",
            "name": "Rubric overall score",
            "role": "secondary",
            "direction": "increase_is_good",
            "type": "ratio",
            "source": "rubric.yaml"
          },
          {
            "id": "bundle_kb",
            "name": "Client bundle size",
            "role": "secondary",
            "direction": "decrease_is_good",
            "type": "count",
            "unit": "kB",
            "budget": 240,
            "source": "benchmarks.yaml"
          }
        ],
        "analysis": {
          "method": "custom",
          "model": "adlc-deterministic-comparison"
        },
        "preRegistration": {
          "digest": "sha256:1d1f0b6f3f7c9a2e4b8d0c5a7e9f1b3d5f7a9c1e3b5d7f9a1c3e5b7d9f1a3c5e",
          "plannedAt": "2026-08-19T09:10:00Z",
          "gitSha": "3f1a9c7e2b4d6081a5c3e7f902b4d6081a5c3e7f",
          "path": "experiment/plan.json"
        }
      }
    },
    {
      "stage": "experiment",
      "attempt": 2,
      "status": "ok",
      "startedAt": "2026-08-19T09:20:00Z",
      "endedAt": "2026-08-19T09:20:02Z",
      "outputs": ["experiment/exposure.json"],
      "message": "recorded exposure for 1 flag key(s) via provider 'flagd-file'",
      "data": {
        "phase": "run",
        "exposure": {
          "provider": "flagd-file",
          "providerNote": "flag definitions materialized",
          "manifest": "flags.flagd.json",
          "variants": { "control": [], "candidate-a": ["adlc.exp.a1b2"] },
          "flagKeys": ["adlc.exp.a1b2"],
          "evaluations": []
        }
      }
    },
    {
      "stage": "experiment",
      "attempt": 3,
      "status": "ok",
      "startedAt": "2026-08-19T10:05:00Z",
      "endedAt": "2026-08-19T10:05:03Z",
      "outputs": ["experiment/analysis.json"],
      "digest": "sha256:7c9a2e4b8d0c5a7e9f1b3d5f7a9c1e3b5d7f9a1c3e5b7d9f1a3c5e1d1f0b6f3f",
      "message": "4 comparison(s) computed against baseline 'control' from 8 measurement(s)",
      "data": {
        "phase": "analyze",
        "baselineVariantKey": "control",
        "experiment": {
          "id": "exp-dark-mode-a1b2",
          "title": "Dark mode: token-driven theme vs. duplicated stylesheet",
          "status": "analyzed",
          "hypothesis": "Deriving the dark theme from design tokens lowers Largest Contentful Paint and removes the remaining contrast violations, without regressing bundle size beyond budget.",
          "summary": "Two build candidates at two commits, compared on a fixed evidence suite.",
          "tags": ["ui", "accessibility"]
        },
        "analysis": {
          "method": "custom",
          "model": "adlc-deterministic-comparison",
          "generatedAt": "2026-08-19T10:05:00Z"
        },
        "measurements": [
          {
            "metricId": "lcp_ms",
            "variantKey": "control",
            "value": 2000,
            "collector": "lighthouse",
            "artifactSha256": "b1946ac92492d2347c6235b4d2611184b1946ac92492d2347c6235b4d2611184"
          },
          {
            "metricId": "a11y_violations",
            "variantKey": "control",
            "value": 2,
            "collector": "axe"
          },
          { "metricId": "rubric_overall", "variantKey": "control", "value": 0.5, "collector": "deterministic" },
          { "metricId": "bundle_kb", "variantKey": "control", "value": 200, "collector": "build" },
          {
            "metricId": "lcp_ms",
            "variantKey": "candidate-a",
            "value": 1750,
            "collector": "lighthouse",
            "artifactSha256": "c3499c2729730a7f807efb8676a92dcb6f8a3f8fc3499c2729730a7f807efb86"
          },
          {
            "metricId": "a11y_violations",
            "variantKey": "candidate-a",
            "value": 0,
            "collector": "axe"
          },
          { "metricId": "rubric_overall", "variantKey": "candidate-a", "value": 0.75, "collector": "deterministic" },
          { "metricId": "bundle_kb", "variantKey": "candidate-a", "value": 250, "collector": "build" }
        ],
        "results": {
          "metricResults": [
            {
              "metricId": "lcp_ms",
              "role": "primary",
              "comparison": { "baselineVariantId": "control", "variantId": "candidate-a" },
              "baselineValue": 2000.0,
              "variantValue": 1750.0,
              "absoluteDifference": -250.0,
              "relativeDifference": -0.125,
              "resultStatus": "positive",
              "decisionImpact": "supports_ship",
              "adlc:measurementBasis": "deterministic_single_measurement",
              "adlc:budget": 2500,
              "adlc:budgetPassed": true,
              "adlc:collector": "lighthouse",
              "adlc:artifactSha256": "c3499c2729730a7f807efb8676a92dcb6f8a3f8fc3499c2729730a7f807efb86"
            },
            {
              "metricId": "a11y_violations",
              "role": "guardrail",
              "comparison": { "baselineVariantId": "control", "variantId": "candidate-a" },
              "baselineValue": 2.0,
              "variantValue": 0.0,
              "absoluteDifference": -2.0,
              "relativeDifference": -1.0,
              "resultStatus": "positive",
              "decisionImpact": "informational",
              "adlc:measurementBasis": "deterministic_single_measurement",
              "adlc:budget": 0,
              "adlc:budgetPassed": true,
              "adlc:collector": "axe"
            },
            {
              "metricId": "rubric_overall",
              "role": "secondary",
              "comparison": { "baselineVariantId": "control", "variantId": "candidate-a" },
              "baselineValue": 0.5,
              "variantValue": 0.75,
              "absoluteDifference": 0.25,
              "relativeDifference": 0.5,
              "resultStatus": "positive",
              "decisionImpact": "informational",
              "adlc:measurementBasis": "deterministic_single_measurement",
              "adlc:collector": "deterministic"
            },
            {
              "metricId": "bundle_kb",
              "role": "secondary",
              "comparison": { "baselineVariantId": "control", "variantId": "candidate-a" },
              "baselineValue": 200.0,
              "variantValue": 250.0,
              "absoluteDifference": 50.0,
              "relativeDifference": 0.25,
              "resultStatus": "negative",
              "decisionImpact": "needs_followup",